URL,Post,Comments
https://www.facebook.com/positivafmradio,Hoy el #Top21Positiva rinde un homenaje especial a nuestros artistas colombianos  20 de julio “día de la independencia”Cuéntanos que artista te representa,"Manuel Blanco: Una vergüenza que tengan el nombre de boyacá, representan la corrupción y el daño que han hecho"
https://www.facebook.com/positivafmradio,¿Fin de semana de asado?  ¿cuál es el plan?,Sandra Patricia Alba Becerra
https://www.facebook.com/positivafmradio,"Inicia la cuadragésima tercera Semana Internacional de la Cultura Bolivariana y de los Países Hermanos, Territorios de Paz. Nuestra Biblioteca Zenón Solano Rica… Ver más","Fan destacado: Kapriccio Tablas Quesos: Buenísimo, lastima el día "
https://www.facebook.com/positivafmradio,¿Qué los hace sentir colombiano?,"Luis Javier Bello Mendoza: Foto Porras, también conocida como foto Gevaert."
https://www.facebook.com/groups/6669773836451212,"EN VENTA CASA CAMPESTRE A 15 MINUTOS DEL CENTRO DE MONIQUIRA.   311 4579858  UN CLIMA CÁLIDO MUY AGRADABLE, AMBIENTE SANO Y MUY SEGURO … Ver más",Mtb Boyaca Boyaca: Es una ganga lástima que el barrió es tan peligroso..pero si es tentador
